{
  "id": "dau-an",
  "names": {
    "default": "Dầu ăn"
  },
  "aliases": [],
  "category": "gia-vi",
  "aisle": "kho-gia-vi",
  "proteinSource": null,
  "marketUnit": {
    "default": {
      "display": "chai",
      "gramsPerUnit": 1000,
      "step": 1
    }
  },
  "wasteRatio": 0,
  "isPantry": true,
  "nutritionPer100gEdible": {
    "kcal": null,
    "proteinG": null,
    "fatG": null,
    "carbG": null,
    "fiberG": null,
    "sodiumMg": null
  },
  "nutritionSource": {
    "db": "placeholder",
    "ref": null,
    "matchedName": null,
    "verifiedBy": null,
    "verifiedAt": null
  },
  "image": {
    "thumb": null,
    "full": null,
    "source": null,
    "license": null,
    "isIllustration": false
  }
}
