{
  "id": "bong-cai-xanh",
  "names": {
    "default": "Bông cải xanh",
    "north": "Súp lơ xanh"
  },
  "aliases": [
    "súp lơ xanh"
  ],
  "category": "rau-cu",
  "aisle": "rau-cu-qua",
  "proteinSource": null,
  "marketUnit": {
    "default": {
      "display": "bông",
      "gramsPerUnit": 400,
      "step": 1
    }
  },
  "wasteRatio": 0.35,
  "isPantry": false,
  "nutritionPer100gEdible": {
    "kcal": null,
    "proteinG": null,
    "fatG": null,
    "carbG": null,
    "fiberG": null,
    "sodiumMg": null
  },
  "nutritionSource": {
    "db": "placeholder",
    "ref": null,
    "matchedName": null,
    "verifiedBy": null,
    "verifiedAt": null
  },
  "image": {
    "thumb": null,
    "full": null,
    "source": null,
    "license": null,
    "isIllustration": false
  }
}
