{
  "id": "thit-ba-chi",
  "names": {
    "default": "Thịt ba chỉ",
    "south": "Thịt ba rọi"
  },
  "aliases": [
    "ba rọi",
    "thịt ba rọi"
  ],
  "category": "thit-heo",
  "aisle": "thit-ca",
  "proteinSource": "heo",
  "marketUnit": {
    "north": {
      "display": "lạng",
      "gramsPerUnit": 100,
      "step": 0.5
    },
    "south": {
      "display": "g",
      "gramsPerUnit": 1,
      "step": 50
    },
    "default": {
      "display": "g",
      "gramsPerUnit": 1,
      "step": 50
    }
  },
  "wasteRatio": 0,
  "isPantry": false,
  "nutritionPer100gEdible": {
    "kcal": 518,
    "proteinG": 9.34,
    "fatG": 53,
    "carbG": 0,
    "fiberG": 0,
    "sodiumMg": 32
  },
  "nutritionSource": {
    "db": "usda-fdc",
    "ref": "167812",
    "matchedName": "Pork, fresh, belly, raw",
    "verifiedBy": "Hoang Thong",
    "verifiedAt": "2026-10-20"
  },
  "image": {
    "thumb": null,
    "full": null,
    "source": null,
    "license": null,
    "isIllustration": false
  }
}
