{
  "id": "ngon-su-su",
  "names": {
    "default": "Ngọn su su"
  },
  "aliases": [
    "rau su su"
  ],
  "category": "rau-la",
  "aisle": "rau-cu-qua",
  "proteinSource": null,
  "marketUnit": {
    "default": {
      "display": "mớ",
      "gramsPerUnit": 300,
      "step": 1
    }
  },
  "wasteRatio": 0.4,
  "isPantry": false,
  "nutritionPer100gEdible": {
    "kcal": null,
    "proteinG": null,
    "fatG": null,
    "carbG": null,
    "fiberG": null,
    "sodiumMg": null
  },
  "nutritionSource": {
    "db": "placeholder",
    "ref": null,
    "matchedName": null,
    "verifiedBy": null,
    "verifiedAt": null
  },
  "image": {
    "thumb": null,
    "full": null,
    "source": null,
    "license": null,
    "isIllustration": false
  }
}
