{
  "id": "ga-ta",
  "names": {
    "default": "Gà ta"
  },
  "aliases": [
    "gà nguyên con"
  ],
  "category": "thit-ga",
  "aisle": "thit-ca",
  "proteinSource": "ga",
  "marketUnit": {
    "default": {
      "display": "con",
      "gramsPerUnit": 1300,
      "step": 1,
      "showApproxGrams": true
    }
  },
  "wasteRatio": 0.35,
  "isPantry": false,
  "nutritionPer100gEdible": {
    "kcal": null,
    "proteinG": null,
    "fatG": null,
    "carbG": null,
    "fiberG": null,
    "sodiumMg": null
  },
  "nutritionSource": {
    "db": "placeholder",
    "ref": null,
    "matchedName": null,
    "verifiedBy": null,
    "verifiedAt": null
  },
  "image": {
    "thumb": null,
    "full": null,
    "source": null,
    "license": null,
    "isIllustration": false
  }
}
