{
  "id": "thit-bo",
  "names": {
    "default": "Thịt bò"
  },
  "aliases": [
    "bò",
    "thịt bò thăn"
  ],
  "category": "thit-bo",
  "aisle": "thit-ca",
  "proteinSource": "bo",
  "marketUnit": {
    "north": {
      "display": "lạng",
      "gramsPerUnit": 100,
      "step": 0.5
    },
    "default": {
      "display": "g",
      "gramsPerUnit": 1,
      "step": 50
    }
  },
  "wasteRatio": 0,
  "isPantry": false,
  "nutritionPer100gEdible": {
    "kcal": null,
    "proteinG": null,
    "fatG": null,
    "carbG": null,
    "fiberG": null,
    "sodiumMg": null
  },
  "nutritionSource": {
    "db": "placeholder",
    "ref": null,
    "matchedName": null,
    "verifiedBy": null,
    "verifiedAt": null
  },
  "image": {
    "thumb": null,
    "full": null,
    "source": null,
    "license": null,
    "isIllustration": false
  }
}
