{
  "id": "dau-phu-non",
  "names": {
    "default": "Đậu phụ non",
    "south": "Đậu hũ non"
  },
  "aliases": [
    "tàu hũ non"
  ],
  "category": "dau-hu",
  "aisle": "trung-dau-phu",
  "proteinSource": "chay",
  "marketUnit": {
    "default": {
      "display": "hộp",
      "gramsPerUnit": 300,
      "step": 1
    }
  },
  "wasteRatio": 0,
  "isPantry": false,
  "nutritionPer100gEdible": {
    "kcal": null,
    "proteinG": null,
    "fatG": null,
    "carbG": null,
    "fiberG": null,
    "sodiumMg": null
  },
  "nutritionSource": {
    "db": "placeholder",
    "ref": null,
    "matchedName": null,
    "verifiedBy": null,
    "verifiedAt": null
  },
  "image": {
    "thumb": null,
    "full": null,
    "source": null,
    "license": null,
    "isIllustration": false
  }
}
