{
  "id": "ca-rot",
  "names": {
    "default": "Cà rốt"
  },
  "aliases": [],
  "category": "rau-cu",
  "aisle": "rau-cu-qua",
  "proteinSource": null,
  "marketUnit": {
    "default": {
      "display": "củ",
      "gramsPerUnit": 120,
      "step": 1
    }
  },
  "wasteRatio": 0.15,
  "isPantry": false,
  "nutritionPer100gEdible": {
    "kcal": 45,
    "proteinG": 0.941,
    "fatG": 0.351,
    "carbG": 10.3,
    "fiberG": 3.1,
    "sodiumMg": 86.6
  },
  "nutritionSource": {
    "db": "usda-fdc",
    "ref": "2258586",
    "matchedName": "Carrots, mature, raw",
    "verifiedBy": "Hoang Thong",
    "verifiedAt": "2026-10-20"
  },
  "image": {
    "thumb": null,
    "full": null,
    "source": null,
    "license": null,
    "isIllustration": false
  }
}
