{
  "id": "khoai-mon",
  "names": {
    "default": "Khoai môn"
  },
  "aliases": [],
  "category": "rau-cu",
  "aisle": "rau-cu-qua",
  "proteinSource": null,
  "marketUnit": {
    "north": {
      "display": "lạng",
      "gramsPerUnit": 100,
      "step": 0.5
    },
    "default": {
      "display": "g",
      "gramsPerUnit": 1,
      "step": 50
    }
  },
  "wasteRatio": 0.2,
  "isPantry": false,
  "nutritionPer100gEdible": {
    "kcal": null,
    "proteinG": null,
    "fatG": null,
    "carbG": null,
    "fiberG": null,
    "sodiumMg": null
  },
  "nutritionSource": {
    "db": "placeholder",
    "ref": null,
    "matchedName": null,
    "verifiedBy": null,
    "verifiedAt": null
  },
  "image": {
    "thumb": null,
    "full": null,
    "source": null,
    "license": null,
    "isIllustration": false
  }
}
