{
  "id": "nam-huong",
  "names": {
    "default": "Nấm hương",
    "south": "Nấm đông cô"
  },
  "aliases": [
    "nấm đông cô"
  ],
  "category": "nam",
  "aisle": "kho-gia-vi",
  "proteinSource": null,
  "marketUnit": {
    "default": {
      "display": "gói",
      "gramsPerUnit": 50,
      "step": 1
    }
  },
  "wasteRatio": 0.05,
  "isPantry": true,
  "nutritionPer100gEdible": {
    "kcal": null,
    "proteinG": null,
    "fatG": null,
    "carbG": null,
    "fiberG": null,
    "sodiumMg": null
  },
  "nutritionSource": {
    "db": "placeholder",
    "ref": null,
    "matchedName": null,
    "verifiedBy": null,
    "verifiedAt": null
  },
  "image": {
    "thumb": null,
    "full": null,
    "source": null,
    "license": null,
    "isIllustration": false
  }
}
